CD_FONTE;DENOMINACAO_FONTE;Analise DCMEFO
1;CONVĘNIOS COM A UNIĂO E SUAS ENTIDADES - EMENDAS INDIVIDUAIS;NĂO
2;CONVĘNIOS COM A UNIĂO E SUAS ENTIDADES - EMENDAS DE BANCADA;NĂO
3;TRANSFERĘNCIAS DO FNDE VINCULADAS Ŕ EDUCAÇĂO - EMENDAS INDIVIDUAIS;NĂO
4;TRANSFERĘNCIAS DO FNDE VINCULADAS Ŕ EDUCAÇĂO - EMENDAS DE BANCADA;NĂO
5;TRANSFERĘNCIAS DA UNIĂO VINCULADAS Ŕ ASSISTĘNCIA SOCIAL - EMENDAS INDIVIDUAIS;NĂO
6;TRANSFERĘNCIAS DA UNIĂO VINCULADAS Ŕ ASSISTĘNCIA SOCIAL - EMENDAS DE BANCADA;NĂO
7;TRANSFERĘNCIAS DA UNIĂO POR MEIO DE PORTARIA - EMENDAS INDIVIDUAIS;NĂO
8;TRANSFERĘNCIAS DA UNIĂO POR MEIO DE PORTARIA - EMENDAS DE BANCADA;NĂO
9;TERMOS DE AJUSTAMENTO, DOAÇŐES CONTROLADAS POR INSTRUMENTO JURÍDICO E CONGĘNERES;NĂO
10;RECURSOS ORDINÁRIOS - RECURSOS NĂO VINCULADOS DE IMPOSTOS;NĂO
11;RECURSOS DE DESVINCULAÇĂO DE RECEITAS - EC 93/2016;NĂO
12;OPERAÇŐES DE CRÉDITO CONTRATUAIS - SWAP;NĂO
13;FUNDO DE MANUTENCAO E DESENVOLVIMENTO DA EDUCACAO BÁSICA - FUNDEB - REGULARIZAÇĂO DE EXERCÍCIOS ANTERIORES;NĂO
14;RECURSOS DE DEPÓSITOS JUDICIAIS - LIDES DAS QUAIS O ENTE FAZ PARTE;NĂO
15;RECURSOS ORDINÁRIOS - OUTROS RECURSOS NĂO VINCULADOS;NĂO
16;DEMAIS TRANSFERĘNCIAS VINCULADAS DA UNIĂO;NĂO
17;TRANSFERĘNCIAS DESTINADAS AO SETOR CULTURAL - LC 195/2022 - ART 5ş - AUDIOVISUAL;NĂO
18;AUXÍLIO FINANCEIRO PELA OUTORGA DE CRÉDITO TRIBUTÁRIO - ICMS ETANOL;NĂO
19;RECURSOS NĂO VINCULADOS DA COMPENSAÇĂO DE IMPOSTOS;NĂO
20;RECURSOS CONSTITUC.VINCULADOS AOS MUNICÍPIOS;NĂO
21;COTA ESTADUAL DO SALÁRIO EDUCAÇĂO - QESE;SIM
22;TRANSFERĘNCIAS DO SUS PARA ATENÇĂO DE MÉDIA E ALTA COMPLEXIDADE AMBULATORIAL E HOSPITALAR;NĂO
23;FUNDO DE MANUTENCAO E DESENVOLVIMENTO DA EDUCACAO BASICA - FUNDEB;NĂO
24;CONVĘNIOS COM A UNIĂO E SUAS ENTIDADES - EXCETO EMENDAS INDIVIDUAIS E DE BANCADA;NĂO
25;OPERAÇŐES DE CRÉDITO CONTRATUAIS;NĂO
26;TAXA FLORESTAL - ADMINISTRAÇĂO INDIRETA;SIM
27;TAXA DE SEGURANÇA PÚBLICA;SIM
28;TAXA DE FISCALIZAÇĂO JUDICIÁRIA;SIM
29;TAXA DE EXPEDIENTE - ADMINISTRAÇĂO DIRETA;SIM
30;CONTRIBUIÇĂO Ŕ APOSENTADORIA;NĂO
31;UTILIZAÇĂO DE RECURSOS HÍDRICOS;NĂO
32;EXPLORAÇĂO DE RECURSOS MINERAIS;NĂO
33;EXPLORAÇĂO E PRODUÇĂO DE PETRÓLEO E GÁS NATURAL;NĂO
34;NOTIFICAÇĂO DE INFRAÇĂO DE TRÂNSITO;NĂO
35;CONTRIBUIÇĂO AO FUNDESE;NĂO
36;TRANSFERĘNCIAS DO FNDE VINCULADOS Ŕ EDUCAÇĂO - EXCETO EMENDAS INDIVIDUAIS E DE BANCADA;NĂO
37;TRANSFERĘNCIAS DA UNIĂO VINCULADOS Ŕ SAÚDE;NĂO
38;TRANSFERĘNCIAS DA UNIĂO VINCULADAS AO ESPORTE;SIM
39;MULTAS PECUNIÁRIAS E JUROS DE MORA FIXADOS EM SENTENÇAS JUDICIAIS;SIM
40;RECURSOS FUNDOS EXTINTOS-LEI Nş 13.848/2001;NĂO
41;CESSĂO DE CRÉDITOS;NĂO
42;CONTRIBUIÇĂO PATRONAL PARA O RPPS;NĂO
43;CONTRIBUIÇĂO DO SERVIDOR PARA O RPPS;NĂO
44;COMPENSAÇĂO FINANCEIRA ENTRE REGIMES DE PREVIDĘNCIA;NĂO
45;DOAÇŐES DE PESSOAS FÍSICAS OU JURÍDICAS, DE INSTITUIÇŐES PRIVADAS OU DO EXTERIOR A ÓRGĂO E ENTIDADES DO ESTADO;SIM
46;DOAÇŐES DE PESSOAS FÍSICAS OU JURÍDICAS, DE INSTITUIÇŐES PRIVADAS OU DO EXTERIOR AO TESOURO ESTADUAL;SIM
47;ALIENAÇĂO DE BENS DE ENTIDADES ESTADUAIS;SIM
48;ALIENAÇĂO DE BENS DO TESOURO ESTADUAL;NĂO
49;CONTRIBUIÇĂO PATRONAL DO ESTADO AOS INSTITUTOS DE PREVIDĘNCIA;SIM
50;CONTRIBUIÇĂO DO SERVIDOR DO ESTADO AOS INSTITUTOS DE PREVIDĘNCIA;SIM
51;CONTRIBUIÇĂO DE INTERVENÇĂO NO DOMÍNIO ECONÔMICO/COMBUSTÍVEIS-CIDE;SIM
52;TAXA DE CONTROLE E FISCALIZAÇĂO AMBIENTAL;SIM
53;TAXA DE INCĘNDIO;NĂO
54;TAXA DE LICENCIAMENTO DA FAIXA DE DOMÍNIO DAS RODOVIAS;SIM
55;TRANSFERĘNCIAS DOS MUNICÍPIOS VINCULADOS Ŕ FARMÁCIA BÁSICA - FES;SIM
56;TRANSFERĘNCIAS DA UNIĂO VINCULADAS Ŕ ASSISTĘNCIA SOCIAL - EXCETO EMENDAS INDIVIDUAIS E DE BANCADA;NĂO
57;TRANSFERĘNCIAS DA UNIĂO POR MEIO DE PORTARIA - EXCETO EMENDAS INDIVIDUAIS E DE BANCADA;NĂO
58;RECURSOS PARA COBERTURA DE INSUFICIĘNCIA FINANCEIRA DO RPPS;NĂO
59;OUTROS RECURSOS VINCULADOS;SIM
60;RECURSOS DIRETAMENTE ARRECADADOS;SIM
61;RECURSOS DIRETAMENTE ARRECADADOS COM VINCULAÇĂO ESPECÍFICA;SIM
62;TRANSFERĘNCIAS DA UNIĂO VINCULADAS Ŕ SAÚDE - BLOCO MANUTENÇĂO - EMENDAS INDIVIDUAIS;NĂO
63;TRANSFERĘNCIAS DA UNIĂO VINCULADAS Ŕ SAÚDE - BLOCO MANUTENÇĂO - EMENDAS DE BANCADA;NĂO
64;TRANSFERĘNCIAS DA UNIĂO VINCULADAS Ŕ SAÚDE - BLOCO ESTRUTURAÇĂO - EMENDAS INDIVIDUAIS;NĂO
65;TRANSFERĘNCIAS DA UNIĂO VINCULADAS Ŕ SAÚDE - BLOCO ESTRUTURAÇĂO - EMENDAS DE BANCADA;NĂO
66;ACORDOS E AJUSTES DE COOPERAÇĂO MÚTUA COM OS ESTADOS E O DISTRITO FEDERAL;NĂO
67;ACORDOS E AJUSTES DE COOPERAÇĂO MÚTUA COM OS MUNICÍPIOS;NĂO
68;CONVĘNIOS COM AS INSTITUIÇŐES PRIVADAS E OS ORGANISMOS DO EXTERIOR;NĂO
69;CONVĘNIOS COM OS ESTADOS E O DISTRITO FEDERAL;NĂO
70;CONVĘNIOS COM OS MUNICÍPIOS;NĂO
71;RECURSOS DO FUNDO ESTADUAL DE ERRADICACAO DA MISERIA;NĂO
72;TAXA DE FISCALIZACAO DE RECURSOS MINERARIOS;NĂO
73;ACORDOS E AJUSTES DE COOPERAÇĂO MÚTUA COM A UNIĂO E SUAS ENTIDADES.;NĂO
74;ACORDOS E AJUSTES DE COOPERAÇĂO MÚTUA COM AS INSTITUIÇŐES PRIVADAS E OS ORGANISMOS DO EXTERIOR;NĂO
75;CONTRIBUICAO PATRONAL PARA CUSTEIO DOS PROVENTOS DOS MILITARES;NĂO
76;TAXA DE ADMINISTRACAO DO FUNPEMG;SIM
77;TAXA DE FISCALIZAÇĂO JUDICIÁRIA E TAXAS E MULTAS JUDICIAIS;SIM
78;CONTRIBUIÇĂO MILITAR PARA CUSTEIO DO SISTEMA DE PROTEÇĂO SOCIAL DOS MILITARES;NĂO
79;RECURSOS DECORRENTES DA CONVERSĂO DE MULTAS AMBIENTAIS;SIM
80;RECURSOS DO ACORDO DE REPACTUAÇĂO DO RIO DOCE;NĂO
81;RECURSOS DE DEPÓSITOS JUDICIAIS LEI 21.720/15;NĂO
82;NOTIFICACAO DE INFRACAO DE TRANSITO ESTADO;NĂO
83;NOTIFICACAO DE INFRACAO DE TRANSITO FUNTRANS;SIM
84;TRANSFERĘNCIAS DO SUS PARA A GESTĂO DO SUS;NĂO
85;TRANSFERĘNCIAS DO SUS PARA A VIGILÂNCIA EM SAÚDE;NĂO
86;TRANSFERĘNCIAS DO SUS PARA A ASSISTĘNCIA FARMACĘUTICA;NĂO
87;TRANSFERĘNCIAS DO SUS PARA A ATENÇĂO BÁSICA;NĂO
88;TRANSFERĘNCIAS DO SUS PARA INVESTIMENTOS NA REDE DE SERVIÇOS DE SAÚDE;NĂO
89;RECURSOS DECORRENTES DA OPERAÇĂO DE SECURITIZAÇĂO DOS ATIVOS DO FECIDAT;SIM
90;TRANSFERĘNCIAS DO FUNDEB - COMPLEMENTAÇĂO DA UNIĂO - VAAR;SIM
91;TAXA DE EXPEDIENTE - ADMINISTRAÇĂO INDIRETA;SIM
92;TRANSFERĘNCIAS DA UNIĂO VINCULADAS Ŕ SAÚDE - BLOCO MANUTENÇĂO - EXCETO EMENDAS INDIV. E DE BANCADA;NĂO
93;TRANSFERĘNCIAS DA UNIĂO VINCULADAS Ŕ SAÚDE - BLOCO ESTRUTURAÇĂO - EXCETO EMENDAS INDIV. E DE BANCADA;NĂO
94;TAXA FLORESTAL - ADMINISTRAÇĂO DIRETA;SIM
95;RECURSOS RECEBIDOS POR DANOS ADVINDOS DE DESASTRES SOCIOAMBIENTAIS;NĂO
96;BÔNUS DE ASSINATURA DO EXCEDENTE DA CESSĂO ONEROSA PELA EXPLORAÇĂO DO PRÉ-SAL;NĂO
97;TRANSFERĘNCIAS ESPECIAIS DE RECURSOS DA UNIĂO - RECURSOS RECEBIDOS ATÉ 2023;NĂO
98;TRANSFERĘNCIAS ESPECIAIS DE RECURSOS DA UNIĂO;NĂO
99;AUXÍLIO FINANCEIRO RECEBIDO DA UNIĂO PARA APLICAÇĂO EM AÇŐES DE ENFRENTAMENTO AO CORONAVÍRUS;NĂO
